{
  "$schema": "https://json-schema.org/draft/2020-12/schema",
  "$id": "https://riot.protest.net/release/schemas/apple-metadata.v1.json",
  "type": "object",
  "additionalProperties": false,
  "required": ["schemaVersion", "locale", "fields", "urls", "categories"],
  "properties": {
    "schemaVersion": { "const": 1 },
    "locale": { "const": "en-US" },
    "fields": {
      "type": "object",
      "additionalProperties": false,
      "required": ["name", "subtitle", "promotionalText", "description", "keywords", "releaseNotes"],
      "properties": {
        "name": { "const": "Riot" },
        "subtitle": { "type": "string", "minLength": 1 },
        "promotionalText": { "type": "string", "minLength": 1 },
        "description": { "type": "string", "minLength": 1 },
        "keywords": { "type": "string", "minLength": 1 },
        "releaseNotes": { "type": "string", "minLength": 1 }
      }
    },
    "urls": {
      "type": "object",
      "additionalProperties": false,
      "required": ["privacy", "support", "marketing"],
      "properties": {
        "privacy": { "const": "https://riot.protest.net/privacy/" },
        "support": { "const": "https://riot.protest.net/support/" },
        "marketing": { "const": "https://riot.protest.net/releases/" }
      }
    },
    "categories": {
      "type": "object",
      "additionalProperties": false,
      "required": ["primaryCategory", "secondaryCategory"],
      "properties": {
        "primaryCategory": { "type": "string", "minLength": 1 },
        "secondaryCategory": { "type": "string", "minLength": 1 }
      }
    }
  }
}
