{
  "schemaVersion": 1,
  "locale": "en-US",
  "fields": {
    "name": "Riot",
    "subtitle": "Community news and tools",
    "promotionalText": "Community-owned news and practical tools designed to stay useful locally when networks are unreliable. Version 1.0 is an early-access release.",
    "description": "Community-owned news and practical tools designed to stay useful locally when networks are unreliable. Version 1.0 is an early-access release.\n\n- Follow community newswires.\n- Publish signed updates.\n- Read signatures and community editorial labels.\n- Carry community tools, including shared checklists.\n- Exchange updates nearby with other phones. Nearby exchange is experimental.\n- Keep a local copy available offline.\n\nA valid signature proves source and integrity, not truth. Editorial labels are community signals, not independent factual verification.\n\nRiot is free, with no in-app purchases. Riot is available worldwide.\nPrivacy: https://riot.protest.net/privacy/\nSupport: https://riot.protest.net/support/\nReleases: https://riot.protest.net/releases/",
    "keywords": "community,news,newswire,local,offline,signed,tools,checklist",
    "releaseNotes": "Version 1.0 is an early-access release. First public release: community newswires, signed updates, editorial labels, community tools, experimental nearby exchange, and offline reading."
  },
  "urls": {
    "privacy": "https://riot.protest.net/privacy/",
    "support": "https://riot.protest.net/support/",
    "marketing": "https://riot.protest.net/releases/"
  },
  "categories": {
    "primaryCategory": "News",
    "secondaryCategory": "Lifestyle"
  }
}
